text,label,five_folds,ten_folds,train_test_split"Dann hoffe ich mal für den Unbekannten, dass er mal einen Schlaganfall oder Herzinfarkt erleidet und bei diesem Einsatz auch Jemand das Sanka versteckt.",1.0,4,8,1
"Ich frage mich, ob es solche Vorkommnisse regelmäßig auch in ungarischen, polnischen oder tschechischen Bädern gibt. Ich glaube eher nicht. Woran mag das wohl liegen ? Da kann man nur sagen, glückliche Visegradstaaten. Dort gib es noch Regierungen, die ihre Verantwortung für ihr eigenes Volk ernst nehmen.",0.0,4,8,1
"Vorschlag fürs Drehbuch: Helene Fischer verirrt sich mit einem Schlauchboot in die Fahrrinne MS Silbereisen und Kapitän Florian lässt noch ein paar Kohlen auflegen, damit Helene auch ganz sicher von der Schiffsschraube geschreddert wird. Anschliessend fängt Florian an zu singen und das Schiff sucht eigenständig den nächsten Eisberg, um diesem phonetischen Terorrismus zu entgehen. Das wird ein Quotenhit.....",1.0,4,8,1
""" Wir haben früher Samstags demonstriert und nicht die Stadtverwaltung lahmgelegt ""  Da gibt es einen Unterschied, heute handelt es sich um betreutes demonstrieren.",0.0,4,8,1
"Unter Freunden ist Haare wuscheln oder  jemanden in den Arm zu nehmen, kein Problem.  Wenn der Volkskommissar Juncker allerdings meint, jeden und alles abknutschen zu müssen, dann ist das nur noch abstoßend.  Und wenn er mein, bei einem Gespräch Theresa May am Arm festhalten zu können, dann hätte die Premierministerin Ihrer Britischen Majestät gut daran getan, dem Kerl fünf  Finger durchs Gesicht zu ziehen - und  das derart, daß es für einige Zeit sichtbar ist.  ",1.0,4,8,1
"Gibt es in der SPD eigentlich noch Mitglieder, die, wie meine Gattin seit mehr als 40 Jahren Mitglied, noch schlicht rechnen können. Große Mathematik braucht es da nicht, um zu erkennen, dass das Vorhaben Grundrente nicht zu bezahlen ist. Wissen das a l l e Mitglieder der SPD??",0.0,4,8,1
"Wetten, das die Festgenommenen schneller auf freiem Fuß sind, als die betagte Dame, die vor einigen Tagen einen Ladendiebstahl begangen hatte, mit einem Beutewert von 18 Euro.  Jedenfalls gratuliere ich den Polizeieinsätzen, dass sie die rumänischen LKW-Aufschlitzer festnehmen konnten. Man sollte diese Bande mit den bestohlenen Lkw-Fahrern für fünf Minuten alleine lassen. ",1.0,4,8,1
"Wo ist die Studie über die qualifizierten Ü50, die sich nach unverschuldeter Arbeitslosigkeit als Billiglöhner verdingen müssen, weil sie am Arbeitsmarkt, trotz angeblichem Fachkräftemangel, kaum noch ein Bein auf die Erde bekommen ?",0.0,4,8,1
Ich werde regelmäßig die Umweltspuren blockieren und für ein Verkehrschaos sorgen.,1.0,4,8,1
"Ich bin auch schockiert darüber, dass CDU-, SPD- und FDP-Politiker mit Nazis kooperieren. So etwas könnten man sich bei den Grünen nicht vorstellen. Höchste Zeit, dass Parteien wie NPD und AfD verboten werden!",0.0,4,8,1
Lassen wir sie doch alle in einem Flugzeug fliegen und machen es wie die Polen. Dann haben wir halt ein zweites Smolensk. Dann haben alle Klugscheißer mrecht.,1.0,4,8,1
"Herr Gruhner; außerhab der Partei bisher  weder etwas geleistet noch    gearbeitet;   findet, der Groko fehle der Respekt gegenüber den Jungen; kann es aber nicht mal begründen. Damitysteht ihm der Weg bis zur Kanzlerschaft offen, wenn er auch mit noch dünner, unbedarfter,  und abwegiger argumetierenden  Kollegen wie P. Amthor darum zu kämpfen haben wird.",0.0,4,8,1
Also zurück in die KZ's.,1.0,4,9,1
"Der Eintritt in Notre Dame war kostenfrei,es sei denn ,man wollte die Schatzkammer besuchen.",0.0,4,9,1
"Wär mein Kind betroffen, würden beide den ersten Hafttag nicht überleben! Das Kopfgeld das ich aussetzten würde wäre so hoch, dass das ganze Gefängnis hinter denen her wäre...inkl. der Wärter!",1.0,4,9,1
Man kann nur hoffen das die Wirtschaft diesem ganzen Affentheater langsam mal die kalte Schulter zeigt.  Erst dann werden die Verantwortlichen merken wie schmerzhaft ein Boomerang werden kann.,0.0,4,9,1
"Wo wird denn heute nicht gemeckert. Wahrscheinlich noch zugezogen. Sollen woanders hinziehen und gut ist es. Das Gemeckere über alles und nichts ist kaum noch zu ertragen. Wenn deren Haus mal brennt, einfach brennen lassen....So einfach geht das.... Natürlich auch kein Krankentransport... ",1.0,4,9,1
Wer ist dieser Rapper Farid Bang? Auch auf seiner Bordkarte standen doch deutlich die relevanten Zeiten ausgedruckt. Beim nächsten Mal ganz einfach nicht auf den letzten Drücker am Gate erscheinen...,0.0,4,9,1
"Der hat auch gut Lachen bei der Justiz in der BRD. sollte ihm solche Taten nachgewiesen werden, sollte er in syrische Gefangenschaft und und wir tragen die Kosten.   Dort ist es sicher billiger und einprägsamer für den ""Lachenden"" denn das wird dem dort sicher schnell vergehen.  Jede Wette. ",1.0,4,9,1
"Das ist gut, dass sich der Städtetag sorgt sich nach Lübcke-Attentat um Kommunalpolitiker sorgt. Sind die von der AfD da mit eingeschlossen?",0.0,4,9,1
Wo bleibt nur Lee Harvey Oswald II.?,1.0,4,9,1
Vielleicht mal in der Bedienungsanleitung schmökern?,0.0,4,9,1
"Willkommen im Mittelalter.  Herrgott, dann werft euch doch endlich die A-Bomben gegenseitig ins Land und Ruhe ist.",1.0,4,9,1
Skigebiet? Welch Begriff -  ist es nicht eine ökologisch sensible Mittel-Gebirgs-Landschaft? Schneekanonen? Liftanlagen? (Diesel-)Pistenraupen? Sollte man sich in der Natur nicht mit den Dingen beschäftigen die diese saisonal bietet?  ,0.0,4,9,1
Hoffentlich CO2 neutrales  Reizgas. Wohlstandskinder können sich dann bei Mama um Papa ausweinen. ,1.0,4,9,1
"Haha, zur Rechten Zeit liefert die Bertelsmann-Stiftung eine sog. 'Studie'. So ein Zufall aber auch. Die Frau Bundeskanzlerin von der CDU wird das freuen.  Der Begriff 'Studie' ist für mich auch zu einem Unwort geworden.  ",0.0,4,9,1
"Im Gegensatz zu Karl Lagerfeld würde sicher niemand, wirklich niemand einen toten Oliver Pocher vermissen. ",1.0,4,9,1
"Wäre nix neues: je rechter, desto großzügiger vom Kapital hofiert. Witzig ist nur diesesmal die Richtung - die CDU-Granden mußten damals die schwarzen Koffer noch in die Gegenrichtung kutschieren.  ",0.0,4,9,1
"Liebe Aktivisten, was könnt ihr froh sein, dass vernünftige Menschen sich nicht mit euch auf eine Stufe stellen. Ihr könnt euch nicht gar nicht vorstellen, wie es mir und vielen Weiteren, wenn wir das alles so verfolgen, was ihr da treibt und wie ihr euch verhaltet, in den Fäusten juckt! Nur leider dürfen wir ja nicht so wie wir gerne wollen würden! Euer Glück!",1.0,4,9,1
"Man sollte sich auch die Frage stellen, ob der Datenschutzbeauftragte stefan  brink nach seinen Äußerungen noch haltbar ist. Ein Politiker sollte immer so handeln, dass es nicht illegal ist.",0.0,4,9,1
"Gut so, wer nicht hören will, muss fühlen... Zur Not auch mit Schlagstock und Wasserwerfern... Anders kapiert es dieser Chaotenhaufen wohl nicht...",1.0,4,9,1
"Unfassbar! Ich hoffe, die alte Dame hat diesen Schock halbwegs überwunden und man findet die Täter schnell.",0.0,4,9,1
Solche Menschen sollte an die Wand gestellt werden,1.0,4,9,1
"Gute Idee Herr Spahn. Wir brauchen die jungen frischen Organe, nicht die Leber eines 80jährigen...... ",0.0,4,9,1
Franz Jaffa: Das kann doch nicht Ihr ernst sein! Diese Leute müssen ganz schnell aus dem Verkehr gezogen werden !!!,1.0,4,9,1
"Na hoffentlich kandidiert die Bundestagsabgeordnete zur OB. Wäre ein politischer Lichtblick im kommunalen Alltag. Erfolge hat sie in Düsseldorf im Übrigen reichlich. Ohne StraZi gäbe es z.B. den KöBogen nicht. Ideologiefrei - pragmatisch - gradlinig - ehrlich. Wer sie erlebt hat, weiss diese Eigenschaften an ihr zu schätzen. ",0.0,4,9,1
"Ich ernenne den ""Fridays-for-future"" Hype nun zum Kinderkreuzzug des 21.Jahrhunderts. Er wird enden wie der im 13.Jahrhundert.",1.0,4,9,1
"Unser tägliches AfD Bashing  gib uns  heute. Aber was will man vom Mainstrean noch anderes erwarten, wenn bei den ersten Prognosen zur HH Wahl  bei der ARD über das abschneiden der AfD gejubelt wird?  (Bericht im Merkur)  umso mehr freut es, dass die AfD ihre Wähler in HH trotz der medialen Hetze halten konnten. Da werden auch in Zukunft die Wagen vom Linken Tilly nichts dran ändern. Die Hetze nutzt sich irgendwann ab und langweilt nur noch. ",0.0,4,9,1
"Wer keine Argumente hat, kann ja auf Greta einhaken. ",1.0,4,9,1
noch ein Jahr DEl...kein Mensch braucht diesen Verein...,0.0,4,9,1
